{
 "decision": {
  "lod_weights": {
   "fog_octaves": 1.0,
   "plumes": 1.0,
   "puddles_sharp": 1.0,
   "signage": 1.0,
   "small_lights": 1.0,
   "wisps": 1.0
  },
  "occlusion": {
   "buildings": [
    {
     "bid": "14:15",
     "cut_height": 3.8,
     "opacity": 0.18
    },
    {
     "bid": "15:15",
     "cut_height": 3.8,
     "opacity": 0.18
    },
    {
     "bid": "15:17",
     "cut_height": 4.2475,
     "opacity": 0.1959
    }
   ],
   "params": {
    "occ_T0": 0.2311,
    "occ_T1": -0.1313,
    "occ_T2": -0.1313,
    "occ_T3": -0.1313,
    "occ_T4": -0.1313,
    "occ_a0": 12.0663,
    "occ_amax": 14.0385,
    "occ_cx": 8.0475,
    "occ_cy": -6.9631,
    "occ_cz": 3.8055,
    "occ_edge": 0.6,
    "occ_ghost": 0.18,
    "occ_on": true,
    "occ_stub": 3.8,
    "occ_t0": -0.2038,
    "occ_t1": -0.2038,
    "occ_t2": -0.2038,
    "occ_t3": -0.2038,
    "occ_t4": -0.2038,
    "occ_tsoft": 0.035,
    "occ_ux": -0.3867,
    "occ_uy": -0.9222,
    "occ_v0": -0.3351,
    "occ_v1": -0.2922,
    "occ_v2": -0.2922,
    "occ_v3": -0.2922,
    "occ_v4": -0.2922,
    "occ_vsoft": 0.025
   },
   "unaffected": 412
  },
  "pose": {
   "dist": 12.5645,
   "lens": 30.0,
   "loc": [
    8.0475,
    -6.9631,
    3.8055
   ],
   "pitch": 9.0,
   "shift_x": -0.2026,
   "shift_y": -0.0156,
   "tgt": [
    3.0,
    -18.3,
    1.84
   ],
   "yaw": 204.0
  },
  "zoom_detail": 1.0,
  "zoom_dive": 1.0
 },
 "dive": {
  "duration_s": 3.0,
  "hq_lens": 300.0,
  "hq_pose": {
   "dist": 3833.3333,
   "lens": 300.0,
   "loc": [
    2118.4564,
    -2085.9295,
    2464.0192
   ],
   "pitch": 40.0,
   "shift_x": 0.0,
   "shift_y": 0.0,
   "tgt": [
    42.0348,
    -9.5078,
    0.0
   ],
   "yaw": -45.0
  },
  "lag_k": 1.08,
  "lag_pow": 1.6,
  "overview_pose": {
   "dist": 74.834,
   "lens": 40.0,
   "loc": [
    -11.6265,
    54.3987,
    6.4117
   ],
   "pitch": 2.0,
   "shift_x": -0.0894,
   "shift_y": 0.1169,
   "tgt": [
    -21.0,
    -19.8,
    3.8
   ],
   "yaw": 187.2
  },
  "samples": [
   {
    "pose": {
     "dist": 3833.3333,
     "lens": 300.0,
     "loc": [
      2118.4564,
      -2085.9295,
      2464.0192
     ],
     "pitch": 40.0,
     "shift_x": 0.0,
     "shift_y": 0.0,
     "tgt": [
      42.0348,
      -9.5078,
      0.0
     ],
     "yaw": -45.0
    },
    "u": 0.0,
    "zoom_dive": 0.0
   },
   {
    "pose": {
     "dist": 2550.4626,
     "lens": 243.5223,
     "loc": [
      1710.6515,
      -1048.0197,
      1619.7958
     ],
     "pitch": 39.4159,
     "shift_x": -0.0093,
     "shift_y": 0.0121,
     "tgt": [
      35.5097,
      -10.5732,
      0.3934
     ],
     "yaw": -58.2293
    },
    "u": 0.25,
    "zoom_dive": 0.102
   },
   {
    "pose": {
     "dist": 535.5967,
     "lens": 109.5445,
     "loc": [
      450.8431,
      136.1033,
      266.946
     ],
     "pitch": 29.6606,
     "shift_x": -0.0447,
     "shift_y": 0.0585,
     "tgt": [
      10.5174,
      -14.6539,
      1.9
     ],
     "yaw": -108.9
    },
    "u": 0.5,
    "zoom_dive": 0.4885
   },
   {
    "pose": {
     "dist": 112.4752,
     "lens": 49.2768,
     "loc": [
      24.4469,
      85.7594,
      18.13
     ],
     "pitch": 7.5218,
     "shift_x": -0.0801,
     "shift_y": 0.1048,
     "tgt": [
      -14.4749,
      -18.7346,
      3.4066
     ],
     "yaw": -159.5707
    },
    "u": 0.75,
    "zoom_dive": 0.8892
   },
   {
    "pose": {
     "dist": 74.834,
     "lens": 40.0,
     "loc": [
      -11.6265,
      54.3987,
      6.4117
     ],
     "pitch": 2.0,
     "shift_x": -0.0894,
     "shift_y": 0.1169,
     "tgt": [
      -21.0,
      -19.8,
      3.8
     ],
     "yaw": -172.8
    },
    "u": 1.0,
    "zoom_dive": 1.0
   }
  ]
 },
 "fixtures": [
  {
   "current": null,
   "decision": {
    "lod_weights": {
     "fog_octaves": 1.0,
     "plumes": 1.0,
     "puddles_sharp": 1.0,
     "signage": 1.0,
     "small_lights": 1.0,
     "wisps": 1.0
    },
    "occlusion": {
     "buildings": [
      {
       "bid": "14:15",
       "cut_height": 3.8,
       "opacity": 0.18
      },
      {
       "bid": "15:15",
       "cut_height": 3.8,
       "opacity": 0.18
      },
      {
       "bid": "15:17",
       "cut_height": 4.2475,
       "opacity": 0.1959
      }
     ],
     "params": {
      "occ_T0": 0.2311,
      "occ_T1": -0.1313,
      "occ_T2": -0.1313,
      "occ_T3": -0.1313,
      "occ_T4": -0.1313,
      "occ_a0": 12.0663,
      "occ_amax": 14.0385,
      "occ_cx": 8.0475,
      "occ_cy": -6.9631,
      "occ_cz": 3.8055,
      "occ_edge": 0.6,
      "occ_ghost": 0.18,
      "occ_on": true,
      "occ_stub": 3.8,
      "occ_t0": -0.2038,
      "occ_t1": -0.2038,
      "occ_t2": -0.2038,
      "occ_t3": -0.2038,
      "occ_t4": -0.2038,
      "occ_tsoft": 0.035,
      "occ_ux": -0.3867,
      "occ_uy": -0.9222,
      "occ_v0": -0.3351,
      "occ_v1": -0.2922,
      "occ_v2": -0.2922,
      "occ_v3": -0.2922,
      "occ_v4": -0.2922,
      "occ_vsoft": 0.025
     },
     "unaffected": 412
    },
    "pose": {
     "dist": 12.5645,
     "lens": 30.0,
     "loc": [
      8.0475,
      -6.9631,
      3.8055
     ],
     "pitch": 9.0,
     "shift_x": -0.2026,
     "shift_y": -0.0156,
     "tgt": [
      3.0,
      -18.3,
      1.84
     ],
     "yaw": 204.0
    },
    "zoom_detail": 1.0,
    "zoom_dive": 1.0
   },
   "hover": "L1N0",
   "hover_pose": {
    "dist": 12.0619,
    "lens": 30.0,
    "loc": [
     7.2694,
     -7.6178,
     3.5311
    ],
    "pitch": 9.0,
    "shift_x": -0.2026,
    "shift_y": -0.0156,
    "tgt": [
     3.0,
     -18.74,
     1.6442
    ],
    "yaw": 201.0
   },
   "name": "first",
   "options": [
    "L1N0",
    "L1N1"
   ],
   "walked": []
  },
  {
   "current": "L3N0",
   "decision": {
    "lod_weights": {
     "fog_octaves": 1.0,
     "plumes": 1.0,
     "puddles_sharp": 1.0,
     "signage": 1.0,
     "small_lights": 1.0,
     "wisps": 1.0
    },
    "occlusion": {
     "buildings": [
      {
       "bid": "10:15",
       "cut_height": 3.8,
       "opacity": 0.18
      },
      {
       "bid": "11:15",
       "cut_height": 3.8,
       "opacity": 0.18
      }
     ],
     "params": {
      "occ_T0": 0.3911,
      "occ_T1": 0.0532,
      "occ_T2": 0.0532,
      "occ_T3": 0.0532,
      "occ_T4": 0.0532,
      "occ_a0": 14.7404,
      "occ_amax": 15.7255,
      "occ_cx": -18.5,
      "occ_cy": -3.2732,
      "occ_cz": 3.5676,
      "occ_edge": 0.6,
      "occ_ghost": 0.18,
      "occ_on": true,
      "occ_stub": 3.8,
      "occ_t0": -0.4057,
      "occ_t1": -0.4057,
      "occ_t2": -0.4057,
      "occ_t3": -0.4057,
      "occ_t4": -0.0796,
      "occ_tsoft": 0.035,
      "occ_ux": 0.0164,
      "occ_uy": -0.9999,
      "occ_v0": -0.2459,
      "occ_v1": -0.2324,
      "occ_v2": -0.2324,
      "occ_v3": -0.2324,
      "occ_v4": -0.2313,
      "occ_vsoft": 0.025
     },
     "unaffected": 413
    },
    "pose": {
     "dist": 16.7328,
     "lens": 30.0,
     "loc": [
      -18.5,
      -3.2732,
      3.5676
     ],
     "pitch": 9.0,
     "shift_x": -0.0818,
     "shift_y": 0.0128,
     "tgt": [
      -18.5,
      -19.8,
      0.95
     ],
     "yaw": 180.0
    },
    "zoom_detail": 0.8394,
    "zoom_dive": 1.0
   },
   "hover": "L4N0",
   "hover_pose": {
    "dist": 16.0635,
    "lens": 30.0,
    "loc": [
     -18.2197,
     -4.066,
     3.4629
    ],
    "pitch": 9.0,
    "shift_x": -0.0818,
    "shift_y": 0.0128,
    "tgt": [
     -19.05,
     -19.91,
     0.95
    ],
    "yaw": 183.0
   },
   "name": "mid",
   "options": [
    "L4N0"
   ],
   "walked": [
    "L1N0",
    "L2N0",
    "L3N0"
   ]
  },
  {
   "current": "L6N0",
   "decision": {
    "lod_weights": {
     "fog_octaves": 1.0,
     "plumes": 1.0,
     "puddles_sharp": 1.0,
     "signage": 1.0,
     "small_lights": 1.0,
     "wisps": 1.0
    },
    "occlusion": {
     "buildings": [
      {
       "bid": "5:15",
       "cut_height": 3.8,
       "opacity": 0.18
      },
      {
       "bid": "5:17",
       "cut_height": 3.8,
       "opacity": 0.18
      },
      {
       "bid": "6:14",
       "cut_height": 14.2798,
       "opacity": 0.4806
      },
      {
       "bid": "6:15",
       "cut_height": 3.8,
       "opacity": 0.18
      }
     ],
     "params": {
      "occ_T0": 0.333,
      "occ_T1": 0.333,
      "occ_T2": 0.333,
      "occ_T3": 0.333,
      "occ_T4": 0.333,
      "occ_a0": 13.1202,
      "occ_amax": 16.7947,
      "occ_cx": -49.0637,
      "occ_cy": -5.0578,
      "occ_cz": 3.5059,
      "occ_edge": 0.6,
      "occ_ghost": 0.18,
      "occ_on": true,
      "occ_stub": 3.8,
      "occ_t0": -0.4421,
      "occ_t1": -0.0908,
      "occ_t2": -0.0908,
      "occ_t3": 0.2038,
      "occ_t4": 0.2038,
      "occ_tsoft": 0.035,
      "occ_ux": 0.4521,
      "occ_uy": -0.892,
      "occ_v0": -0.2736,
      "occ_v1": -0.2421,
      "occ_v2": -0.235,
      "occ_v3": -0.2171,
      "occ_v4": -0.2171,
      "occ_vsoft": 0.025
     },
     "unaffected": 411
    },
    "pose": {
     "dist": 16.3385,
     "lens": 30.0,
     "loc": [
      -49.0637,
      -5.0578,
      3.5059
     ],
     "pitch": 9.0,
     "shift_x": 0.0173,
     "shift_y": 0.0077,
     "tgt": [
      -42.5,
      -19.8,
      0.95
     ],
     "yaw": 156.0
    },
    "zoom_detail": 0.8528,
    "zoom_dive": 1.0
   },
   "hover": "L7N0",
   "hover_pose": {
    "dist": 15.685,
    "lens": 30.0,
    "loc": [
     -48.6018,
     -5.4471,
     3.4037
    ],
    "pitch": 9.0,
    "shift_x": 0.0173,
    "shift_y": 0.0077,
    "tgt": [
     -43.05,
     -19.91,
     0.95
    ],
    "yaw": 159.0
   },
   "name": "last",
   "options": [
    "L7N0"
   ],
   "walked": [
    "L1N0",
    "L2N0",
    "L3N0",
    "L4N0",
    "L5N0",
    "L6N0"
   ]
  }
 ],
 "kind": "street",
 "layout_seed": "102",
 "lod": {
  "bands": {
   "cityglow": {
    "a": 0.3,
    "b": 0.9,
    "d_far": 1337.3114,
    "d_near": 162.7871
   },
   "fog_density": {
    "a": 0.3,
    "b": 0.9,
    "d_far": 1337.3114,
    "d_near": 162.7871
   },
   "fog_octaves": {
    "a": 0.25,
    "b": 0.6,
    "d_far": 1593.8604,